,URL,Date,Title,Authors,Categories,Text
50,https://sysblok.ru/philology/chto-my-uznali-ob-udarenii-v-russkom-jazyke-i-o-naivnoj-pojezii-iz-korpusa-stihi-ru/,07.09.2023,Что мы узнали об ударении в русском языке и о наивной поэзии из корпуса stihi.ru,['Яна Хлусова'],['Филология'],"Подкорпус Национального корпуса русского языка, в котором можно изучать ударения русских слов, содержит произведения поэтов-любителей с сайта Стихи.ру. Каким образом они могут быть полезны для науки — читайте в нашем материалеПомните тест Нейросеть vs Стихи.ру? Тексты последнего пополнили акцентологический корпус НКРЯ.В Национальном корпусе русского языка (НКРЯ) помимо основного есть специфические подкорпуса, например, акцентологический. Он создан для исследования русского ударения. В нём есть разные тексты, в частности, те, что входят и в поэтический корпус (XVIII–XXI вв.). Последние полезны тем, что ударение в них проставляется на этапе разметки метра. Иными словами, после определения размера стихотворения место падения ударения становится более очевидным, а это позволяет избежать проверки каждого слова в отдельности (ускорить и автоматизировать процесс).Подробнее об акцентологическом корпусе можно почитать тут.Стихи.ру — старейший русскоязычный сайт, на котором могут публиковаться наивные (непрофессиональные) поэты. Их произведения не проходят специальной редактуры и находятся в открытом доступе. По этой причине наивные стихи не могут быть включены в поэтический корпус НКРЯ: в него входят только культурно значимые и отобранные профессионалами тексты.Тем не менее у наивной поэзии есть очень важная для акцентологического корпуса особенность — ориентация на школьные стихи: авторы-любители зачастую создают нечто похожее на то, что проходят на уроках литературы. Благодаря этому в большинстве текстов чередуются определённым образом ударные и безударные слоги (то есть преобладает силлабо-тоническое стихосложение). Получается, автоматически предсказывать ударение для таких текстов должно быть ещё более удобно, чем для тех, которые входят в поэтический корпус (так как в первых использованы совсем простые размеры). Для этой цели авторы источника использовали машинное обучение. Полученные ими данные существенно пополнили акцентологический корпус.Учёным понадобилась локальная копия Стихов.ру, из которой они выбрали две коллекции текстов: одну случайно, другую — специальным образом. Для неё нужно было посчитать процент совпадения цепочек из двух слов (биграмм) между текстом с сайта и из поэтического корпуса. Пригодились только те произведения, у которых этот процент был не менее 60. Исследователи выдвинули гипотезу: если процент высок, то в выборку попадёт больше текстов с правильными двух- или трёхсложными размерами (не забываем про ориентацию на школьную программу)*. О её проверке расскажем ниже.После отбора произведений использовали программу Ю. Г. Зеленкова, позволяющую определить метр и клаузулу (конец стиха) и разбить текст на стопы (сочетания слога, на которое падает ритмическое ударение, с безударными).Существует предположение о том, что буквы в конце слова и его грамматические свойства (в частности, место падения ударения) связаны. Взглянем на список:Во всех словах, кроме помеченных звёздочками, буквы в конце и место, куда падает ударение, одинаковы. Получается, что вместо длинного списка, можно записать только одно слово, которое будет отражать свойства целого класса. Это будет выглядеть вот так:Специально обученная программа сама расставляет ударения на основе выявленных классов. Более подробно об анализе стихотворений можно почитать в самой статье.В некоторых текстах силлабо-тоническое стихосложение нарушалось. Исследователи пришли к выводу, что это объясняется не переменой размера внутри одного стихотворения, а простыми ошибками. Для таких случаев ввели аббревиатуру «НУР» — неурегулированный размер. Учёные не стали пополнять корпус текстами, в которых больше 30% строк содержали нарушения метра.Выше говорилось о гипотезе: если текст любительского стихотворения совпадает по биграммам на 60% и более с произведениями из поэтического корпуса, то в нём будет лучше выдержана силлабо-тоника, чем в текстах, отобранных случайным образом. Однако полученные данные опровергают эту гипотезу — она не прошла статистические тесты. И в первой коллекции текстов, и во второй наблюдаются нарушения.После пополнения из stihi.ru акцентологический корпус содержит более чем 160 тыс. стихотворений. Поскольку большинство стихотворений написаны распространёнными и регулярными метрами, это  помогло добиться высокой точности автоматической разметки  ударения. А в корпусе стало ещё больше текстов, отражающих реальное использование языка его носителями.* Почему важно, чтобы в метре не было нарушений? Это полезно для автоматической расстановки ударений — будет меньше ошибок со стороны машины.Теги:stihi ru, НКРЯ, поэтический корпусДля чего филологу учиться программировать? Зачем учить нейросети писать стихи? Как мы опираемся на корпусные методы исследования языка в повседневной жизни, даже не замечая этого? Системный Блокъ поговорил с цифровым филологом Борисом Ореховым — доцентом школы лингвистики НИУ ВШЭ и постоянным ведущим нашей рубрики «Нейростихи».Великое, могучее, свободное, подвижное. От праславянской акцентуации к нейросетевым программам автоматической расстановки ударенийПолучайте наши подборки первыми

 Согласен с  политикой конфиденциальности© 2018–2023 Системный Блокъ"
51,https://sysblok.ru/philology/shest-rukopozhatij-vladimira-majakovskogo/,06.09.2023,Шесть рукопожатий Владимира Маяковского,['Полина Янина'],"['История', 'Филология']","Представляем результаты авторского цифрового исследования: граф социальных связей персоналий Серебряного века на основе материалов проекта «Устная история». Центральная фигура — Владимир Маяковский.Я крикнул солнцу:«Погоди!послушай, златолобо,чем так,без дела заходить,ко мнена чай зашло бы!»В. МаяковскийПроект «Устная история» в некоторой степени обязан своим появлением, как ни странно, одному судебному разбирательству.Немного предыстории. В 1965–1966 гг. разразилось знаменитое дело писателей Андрея Синявского и Юлия Даниэля, которое оказало значительное влияние на возникновение и развитие диссидентского движения в СССР. В судебном процессе важную роль сыграл Виктор Дувакин — филолог и архивист, исследователь творчества Владимира Маяковского. Будучи преподавателем одного из обвиняемых, Синявского, на филологическом факультете МГУ, он стал единственным свидетелем со стороны защиты. Это привело к решению учёного совета об увольнении его с факультета.Тем не менее, благодаря инициативе ректора университета И. Г. Петровского, Дувакину предоставили возможность работать на кафедре научной информации МГУ. Именно это назначение послужило отправной точкой для создания уникального проекта сбора мемуарных свидетельств. Дувакин начал работу над «Устной историей» — архивом аудиоинтервью на темы культуры, науки и повседневной жизни ХХ века. Сейчас собранные им ценные материалы хранятся в отделе Устной истории Научной библиотеки МГУ. А с 2015 г. беседы Дувакина со свидетелями эпохи, записанные на плёнку, и всё новые и новые интервью публикуются в открытом доступе на сайте проекта — в результате активной работы его сегодняшних участников.Несмотря на то что уже с 1970 г. Дувакин начал брать интервью у выдающихся людей из самых разных сфер, изначально проект специализировался исключительно на Владимире Маяковском. Его творчество было объектом изучения Дувакина-филолога, поэтому именно о нём учёный в первую очередь стал собирать воспоминания современников — друзей и знакомых. Особенное же внимание при разговоре Дувакин уделял «действующим лицам»: расспрашивал собеседников о конкретных именах и о характере взаимоотношений между участниками событий.Такая отличительная черта аудиоматериалов позволяет использовать данные из них для проведения сетевого анализа — что мы и сделали в авторском цифровом исследовании «Системного Блока».Материалом исследования стали данные о социальных связях внутри культурного общества Серебряного века, сосредоточенного вокруг Маяковского. Вся необходимая информация была получена из записей бесед Дувакина 1960-х гг. Вот перечень собеседников, чьи воспоминания — основа нашего цифрового исследования:Беседы со всеми из них вы можете и услышать, и прочитать на странице коллекции Дувакина.Мы проанализировали транскрипции бесед Дувакина со всеми вышеперечисленными людьми и выделили социальные связи. Для работы было важно, например, если при разговоре упоминалась чья-то совместная работа, романтические отношения, переписка и т. д. Затем данные были загружены в программу Gephi для визуализации полученной «социальной сети» в виде графа. Кстати, «Системный Блокъ» уже писал об этом цифровом инструменте в статье «Как плести виртуальные сети с помощью Gephi».Интерактивный граф был опубликован с помощью GitHub Pages и выложен по ссылке. Рассмотрим полученную схему.Одна точка — один человек. Точки называются узлами, или вершинами графа. Непосредственные собеседники Дувакина обозначены более крупными точками по сравнению с остальными.Люди связаны между собой дугами — рёбрами графа — в соответствии с полученной из интервью информацией об их взаимоотношениях (знакомство/дружба/роман/переписка/встреча). Если кто-то часто упоминается вместе с кем-то, то Gephi автоматически группирует их в сообщества, которые выделены на графе общим цветом.Итак, человеком с самым большим количеством связей, что логично, оказался Маяковский. Непосредственно вокруг него располагается большой кластер деятелей Серебряного века. В нём можно увидеть имена самых разных людей, таких как Лиля Брик, Казимир Малевич или Анатолий Луначарский.В правом верхнем углу выделяется сообщество высокопоставленных большевиков, связанных с Маяковским в основном через В. Б. Шкловского.Благодаря другому собеседнику Дувакина, И. Н. Бажанову, на графе образовался небольшой сектор придворного окружения Николая II (на схеме — голубым цветом). Бажанов был шофёром последнего русского императора.Супруги Сосинские, как наиболее далёкие от общества Маяковского, организовали вокруг себя объёмный обособленный кластер светло- и тёмно-зелёного цветов в правом нижнем углу графа. Он пересекается с основной группой лишь в отдельных случаях (главным образом через Максима Горького и Илью Эренбурга).В левом нижнем углу образовалась ещё одна сильно отдалённая от центра группа рыжего цвета — общество художественной богемы (Васнецов, Серов, Нестеров и др.). Оно связано с центральной областью графа в основном через интервьюируемого Н. Д. Виноградова, а также через Валерия Брюсова и Бориса Пастернака.В левом верхнем углу вокруг отца Е. А. Ланг, книгопродавца Александра Ланга, кластеризуется небольшая группа интеллектуалов конца XIX — начала XX века. В основном она состоит из преподавателей Московского университета (Муромцев, Виппер, Нейдинг и др.).Когда Дувакин проводил свои беседы для проекта «Устная история», ему иногда приходилось убеждать своих собеседников согласиться на интервью, обещая, что их рассказы не будут услышаны современниками. Аудиозаписи были предназначены лишь для потомков из XXI века. И вот сейчас, спустя почти 60 лет, нам, пресловутым «людям XXI века», доступны уникальные сведения о социальных связях между людьми далёкого от нас Серебряного века. А с помощью технологий Digital Humanities мы способны увидеть «сеть рукопожатий» той эпохи прямо перед своими глазами — что, быть может, натолкнет кого-нибудь на научную гипотезу и станет отправной точкой для новых исследований.Пользуйтесь результатами цифровых исследований и изучайте переплетения судеб личностей Серебряного века!Теги:Digital Humanities, Gephi, Владимир Маяковский, сетевой анализ, социальные связиПрименить цифровые технологии к пьесам Шекспира? Да легко! Если вы хотите проанализировать связи между персонажами драматических текстов, то в этом вам поможет интернет-ресурс DraCor. Пройдите наш тест и проверьте, насколько хорошо вы знаете, как работает DraCor!Сильвия Плат — американская поэтесса, основательница жанра «исповедальной поэзии». Ее жизнь была коротка (30 лет) и трагична, и эволюция творчества Плат отражает эту печальную динамику. Рассказываем, как менялись цвета и другие составляющие поэзии Сильвии ПлатПолучайте наши подборки первыми

 Согласен с  политикой конфиденциальности© 2018–2023 Системный Блокъ"
52,https://sysblok.ru/test/chto-vy-znaete-o-probleme-domashnego-i-partnjorskogo-nasilija/,05.09.2023,Что вы знаете о проблеме домашнего и партнёрского насилия? ,['Дария Триана-Ривера'],"['Общество', 'Тесты']","Пройдите тест и узнайте актуальную информацию о ситуации с домашним насилием в РоссииДомашнее насилие — значимая социальная проблема, вокруг которой существует множество мифов. Бывает очень трудно найти актуальную статистику или другую важную информацию. Часто пострадавшие не обращаются в полицию и в медицинские учреждения: по данным Росстата за 2011 год, в полицию обращаются всего около 10% переживших насилие в семье, только 6% женщин обращаются к врачам и 2% — к юристам.Теги:домашнее насилие, тесты10 декабря в Стокгольме Нобелевский комитет наградил лауреатов 2023 года. По этому поводу мы изучили сведения о том, кому вручали премию в течение всей её истории — с 1901 года. Теперь мы знаем, где нужно родиться, в каком университете работать и до скольких лет ждать, чтобы получить признание комитета. Эти и другие наблюдения — в нашем новом материале.Применить цифровые технологии к пьесам Шекспира? Да легко! Если вы хотите проанализировать связи между персонажами драматических текстов, то в этом вам поможет интернет-ресурс DraCor. Пройдите наш тест и проверьте, насколько хорошо вы знаете, как работает DraCor!Получайте наши подборки первыми

 Согласен с  политикой конфиденциальности© 2018–2023 Системный Блокъ"
